Audit ID,Objective requirement,Current live surface,Current status,Evidence now present,Human action needed,Accountable owner role,Next update location,Completion proof required,Risk if skipped,Priority,Target review session,Non-automation boundary,Decision captured?
IRA-001,Appoint owners and complete governance fields,Owner Appointment Routing; Governance Authority Review; Leader Roster; OIB-001; DEC-003; TASK-010; TASK-011,Review required,"Role rows, owner evidence review, appointment templates and governance authority review exist; real names are intentionally blank.","Programme owners nominate candidates and backups, confirm availability/training, then an authorized authority approves final decision rights.",Journey Lead,Leader Roster!A5:H16; Owner Appointment Routing!A5:N16; Governance Authority Review!A5:K16; Leadership Decision Capture,"Named leaders, backups, authority approver, approval date and conditions recorded by accountable humans.",Unclear ownership blocks every downstream gate and can create informal authority without approval.,P0,Leadership implementation session,Does not enter actual names or approve decision rights.,No
IRA-002,Complete seven human-review gates,Human Review Routing; Human Review; Human Review packets; HR-001..HR-007; GATE-002; TASK-012,Review required,"Seven review packets, routing queue, sign-off fields, communications templates and HUMAN-REVIEW-REQUIRED.md are present.","Assign qualified reviewers, target dates and packet routing; each reviewer records authority, decision, date and conditions.",Oversight Lead,Human Review Routing!A5:M11; Human Review!A5:N11; Leadership Review Outputs; Gate Evidence Checklist,"HR-001 through HR-007 have named reviewer, authority, outcome, decision date, conditions and evidence links.","Safety, legal, medical, theology, authority, girls content and copyright risks remain unresolved.",P0,Human review gate session,Does not approve any HR gate or substitute for qualified review.,No
IRA-003,Pilot one real Journey cycle,Pilot Cycle Plan; Pilot Log; Pilot Run Sheet and Debrief Packet; OIB-003; GATE-003; TASK-013,Ready to schedule,"Pilot plan, pilot log, run/debrief packet and evidence-capture templates exist; no real pilot evidence is recorded yet.","Schedule the small leadership-team pilot, run the walkthrough, record unclear steps, duplicated work, missing resources and unnecessary fields.",Journey Lead,Pilot Cycle Plan!A5:M16; Pilot Log; Leadership Review Outputs; Event Readiness!A9:H9,"Pilot date, attendees/roles, non-sensitive observations, debrief summary, accepted changes and follow-up owners recorded.",Unpiloted workflows may look complete while still being confusing or too heavy for the real team.,P0,Pilot planning and debrief,"Does not run the pilot, accept findings or close GATE-003.",No
IRA-004,Replace synthetic examples carefully,Restricted Data Replacement Checklist; Restricted Data Placement Approval Templates; DEC-005; TASK-014; OIB-004; GATE-004,Review required,"Checklist, approval templates and data-cleanup folder exist; no restricted data movement is approved.","Accountable data owner approves storage location, access group, minimum fields, retention and duplicate-copy handling before real information is entered.",Administration Lead,DEC-005; TASK-014; Restricted Data Replacement Checklist; restricted workbooks; data cleanup folder,Approved storage/access decision plus evidence of least-privilege placement and source duplicate handling.,"Real names, participant, medical or financial data may leak into broad/shared places if the approval path is skipped.",P0,Data replacement approval,"Does not move, expose, copy or authorize restricted data.",No
IRA-005,Approve the website access model,Website Access Review; Website Access Model Decision Templates; Website access decision brief; DEC-004; OIB-005; GATE-005,Review required,"Access review matrix, decision brief, decision templates and area-level WAR rows exist; no access model is approved.","Oversight chooses leaders-only, partly public/protected, or public info plus authenticated operational tools, then classifies each website area.",Oversight Lead,Website Access Review!A5:J18; DEC-004; Leadership Decision Capture; Launch Gates!A9:K9,"Selected access model, WAR-001 through WAR-014 decisions, approver, evidence link, conditions and implementation boundary recorded.","Publication or sharing may expose restricted resources, copied benchmark material or unapproved content.",P0,Website access decision,"Does not approve access, broaden sharing or publish.",No
IRA-006,Build and publish the production website,Website Build Backlog; Website Content Review; Publication Approval Templates; DEC-006; TASK-016; OIB-006; GATE-006,Blocked,"Build backlog, content review, prototype, publication templates and benchmark adaptation brief exist; prerequisite approvals remain open.","After access, content, copyright, authority and data approvals exist, confirm build scope, approved version, URL, rollback owner and go/no-go.",Knowledge Management Lead,Website Build Backlog!A5:N24; Website Content Review!A5:N24; DEC-006; TASK-016; Launch Gates!A10:K10,"Approved access/content/copyright/authority/data evidence, accepted build checklist, production URL, rollback owner and publication approval recorded.","A production portal could launch with unapproved content, access, copyright, data or operating authority.",P0,Production go/no-go,"Does not build, deploy, publish or close GATE-006.",No
